{
  "name": "types",
  "version": "0.1.0",
  "abi": {
    "major": 1,
    "minor": 0
  },
  "properties": [
    {
      "name": "p0",
      "type": "bool"
    },
    {
      "name": "p1",
      "type": "int"
    },
    {
      "name": "p2",
      "type": "float"
    },
    {
      "name": "p3",
      "type": "string"
    },
    {
      "name": "p4",
      "type": "bytes"
    },
    {
      "name": "p5",
      "type": "any"
    }
  ]
}
